{
  "$comment": "Test fixture: eight resources between them exercising every recipe role against testdata/shapes/widgets.json. `widget` is the full lifecycle (create, two reads, a mutation, map-shaped tags, an authored operation, list, delete); `cog` is setup-only and its create cannot be bound, so `spare`, which requires it, has its whole group refused with setup-refused; `gauge` is pre-existing and shows that such a resource carries more than its read, and its tags carry KMS's {TagKey, TagValue} spelling; `sprocket` requires `gauge`, verifies its create with an authored assertion rather than a derived read-back, carries {Key, Value}-shaped tags, and is declared async so every clause that calls the service again — authored ones included — is wrapped in `eventually`; `valve` is pre-existing like `gauge`, and its tags pair ordinary {Key, Value} tags with an ELB-style untag list of key-only structures instead of bare strings; `hub` is pre-existing too, and its tag operations take the resource identifier as a list (HubNames) bound from the resource's own scalar export through a wrapped `binds` entry.",
  "service": "widgets",
  "neverProbe": {
    "GetWidgetSecret": "Rotates the secret it returns, so the read verb in its name is a lie; every later reader of the old secret is broken by the call.",
    "PurgeWidgets": "Purges every widget in the account and cannot be undone. It takes no identifier, so no curated literal could make the call miss; the only safe probe is none."
  },
  "allowProbe": {
    "PingWidgets": "A liveness check: it takes no input, changes nothing, and returns the service's own status.",
    "ScanWidgets": "A read AWS happens to spell with a different verb, as DynamoDB does with Scan; it lists widgets and changes nothing."
  },
  "resources": [
    {
      "id": "widget",
      "create": { "op": "CreateWidget", "params": { "Name": { "$name": "w" }, "Color": "blue" } },
      "exports": { "id": "$.WidgetId", "arn": "$.Arn" },
      "binds": { "WidgetId": "widget.id" },
      "read": { "op": "GetWidget", "identityPath": "$.Widget.WidgetId", "identity": "id" },
      "reads": [
        { "op": "DescribeWidget", "identityPath": "$.Widget.WidgetId", "identity": "id" }
      ],
      "list": {
        "op": "ListWidgets",
        "params": { "NamePrefix": { "$name": "w" } },
        "itemsPath": "$.Widgets",
        "identityPath": "$.WidgetId",
        "identity": "id"
      },
      "mutable": [
        { "op": "UpdateWidget", "member": "Description", "from": "one", "to": "two", "readPath": "$.Widget.Description" }
      ],
      "tags": {
        "tag": { "op": "TagWidget", "member": "Tags" },
        "untag": { "op": "UntagWidget", "member": "TagKeys" },
        "list": { "op": "ListWidgetTags", "path": "$.Tags" }
      },
      "operations": [
        {
          "$comment": "PolishWidget returns nothing, so its own response says nothing about whether it worked; the read-back is the whole assertion. The resource is not async, so the clause is emitted as written.",
          "op": "PolishWidget",
          "assert": [
            {
              "kind": "readback",
              "call": { "op": "GetWidget" },
              "checks": { "$.Widget.WidgetId": { "equals": { "$ref": "widget.id" } } }
            }
          ]
        },
        {
          "$comment": "A list clause that walks every page. ListWidgets is @paginated, so the recipe gives the page size and the floor on how many pages must come back and the generator fills the token and page-size members in from the trait. The test is a variant of PolishWidget rather than of ListWidgets because an authored ListWidgets entry would fold the derived list test away.",
          "op": "PolishWidget",
          "name": "PolishWidgetListed",
          "assert": [
            {
              "kind": "listContains",
              "call": { "op": "ListWidgets", "params": { "NamePrefix": { "$name": "w" } } },
              "itemsPath": "$.Widgets",
              "where": { "$.WidgetId": { "$ref": "widget.id" } },
              "paginate": { "pageSize": 1, "minPages": 1 }
            }
          ]
        }
      ],
      "delete": { "op": "DeleteWidget" },
      "notFound": { "error": "WidgetNotFound" }
    },
    {
      "$comment": "Setup-only, and deliberately unbindable: CreateCog.Name is a patterned string with no bind, no matching export and no curated literal, so instantiating this resource is refused and every group that requires it is refused with it.",
      "id": "cog",
      "setupOnly": true,
      "create": { "op": "CreateCog" },
      "exports": { "id": "$.CogId" }
    },
    {
      "$comment": "A second widget, complete in itself, whose only problem is that it requires `cog`. Its group is refused as setup-refused:cog before a single test is emitted — the refusal names the resource that could not be set up, and the operation it names is the create that would otherwise have been fine.",
      "id": "spare",
      "requires": ["cog"],
      "create": { "op": "CreateWidget", "params": { "Name": { "$name": "spare" } } },
      "exports": { "id": "$.WidgetId" },
      "binds": { "WidgetId": "spare.id" },
      "read": { "op": "GetWidget", "identityPath": "$.Widget.WidgetId", "identity": "id" },
      "delete": { "op": "DeleteWidget" },
      "notFound": { "error": "WidgetNotFound" }
    },
    {
      "$comment": "Pre-existing: no create, no delete, and its exports come from its read. Its group is not that read alone — an authored operation binding one of those exports gets a test of its own. Its tags are the {TagKey, TagValue} spelling KMS uses (Tag/ListResourceTags/UntagResource), paired with an ordinary string-list untag — the same untag shape `widget` and `sprocket` use, so this resource isolates the tag-structure axis of detectTagShape from the untag-list axis `valve` isolates below.",
      "id": "gauge",
      "read": {
        "op": "DescribeGauge",
        "identityPath": "$.Gauge.GaugeId",
        "exports": { "id": "$.Gauge.GaugeId", "arn": "$.Gauge.Arn" }
      },
      "binds": { "GaugeId": "gauge.id" },
      "operations": [
        {
          "op": "CalibrateGauge",
          "assert": [
            { "kind": "responseField", "checks": { "$.Status": { "nonEmpty": true } } }
          ]
        }
      ],
      "tags": {
        "tag": { "op": "TagGauge", "member": "Tags" },
        "untag": { "op": "UntagGauge", "member": "TagKeys" },
        "list": { "op": "ListGaugeTags", "path": "$.Tags" }
      }
    },
    {
      "$comment": "Pre-existing, like `gauge`, and exists only to carry a tags block: ordinary {Key, Value} tags (the same structure `sprocket` uses) paired with an untag member that takes a list of key-only structures instead of bare strings — the shape ELB Classic's RemoveTags uses. This isolates the untag-list axis of detectTagShape from the tag-structure axis `gauge` isolates above.",
      "id": "valve",
      "read": {
        "op": "DescribeValve",
        "identityPath": "$.Valve.ValveId",
        "exports": { "id": "$.Valve.ValveId", "arn": "$.Valve.Arn" }
      },
      "binds": { "ValveId": "valve.id" },
      "tags": {
        "tag": { "op": "TagValve", "member": "Tags" },
        "untag": { "op": "UntagValve", "member": "TagKeys" },
        "list": { "op": "ListValveTags", "path": "$.Tags" }
      }
    },
    {
      "$comment": "Pre-existing, like `gauge` and `valve`, and the resource that carries a list-shaped identifier: TagHub, DescribeHubTags and UntagHub all take HubNames — the plural list — which is how ELB Classic's AddTags, DescribeTags and RemoveTags take a load balancer. The read exports the singular name, and `binds` wraps that one export in a one-element list so rule 1 can supply the plural member; every emitter then has to spell a list holding a bound expression. The tag structure is the ordinary {Key, Value} and the untag member a plain string list, so the only axis this resource moves is the identifier's own shape — detectTagShape's two axes stay isolated on `gauge` and `valve`. The tag listing is read at $.TagDescriptions[0].Tags, which is where ELB's DescribeTags puts it.",
      "id": "hub",
      "read": {
        "op": "DescribeHub",
        "identityPath": "$.Hub.HubName",
        "exports": { "name": "$.Hub.HubName" }
      },
      "binds": { "HubNames": ["hub.name"] },
      "tags": {
        "tag": { "op": "TagHub", "member": "Tags" },
        "untag": { "op": "UntagHub", "member": "TagKeys" },
        "list": { "op": "DescribeHubTags", "path": "$.TagDescriptions[0].Tags" }
      }
    },
    {
      "$comment": "Requires the pre-existing gauge, whose read runs in setup and whose ARN the sprocket records. The create is verified by an authored assertion instead of the derived read-back, and `async` wraps that authored clause — it calls the service again — while leaving the responseField clause beside it alone.",
      "id": "sprocket",
      "requires": ["gauge"],
      "create": {
        "op": "CreateSprocket",
        "params": { "Name": { "$name": "s" }, "Description": { "$ref": "gauge.arn" } },
        "assert": [
          {
            "kind": "readback",
            "call": { "op": "GetSprocket" },
            "checks": { "$.Sprocket.Description": { "equals": { "$ref": "gauge.arn" } } }
          }
        ]
      },
      "exports": { "id": "$.SprocketId" },
      "binds": { "SprocketId": "sprocket.id" },
      "read": { "op": "GetSprocket", "identityPath": "$.Sprocket.SprocketId", "identity": "id" },
      "tags": {
        "tag": { "op": "TagSprocket", "member": "Tags" },
        "untag": { "op": "UntagSprocket", "member": "TagKeys" },
        "list": { "op": "ListSprocketTags", "path": "$.Tags" }
      },
      "delete": { "op": "DeleteSprocket" },
      "notFound": { "error": "SprocketNotFound" },
      "async": { "maxAttempts": 3, "delayMs": 100 }
    }
  ]
}
